{
  "schema_version": "1.0",
  "narration_authorization_id": "C6-SYNTHETIC-NARRATION-AUTH-0001",
  "approval_id": "C5-SYNTHETIC-APPROVAL-ONLY-0001",
  "case_id": "glass-river-writing-fixture",
  "upstream_writer_handoff_hash": "fa74fa01838651b8e893159c1c689e443588a3b3cfb2db553aae1f27506db1fb",
  "upstream_editor_handoff_hash": "b7a52f22457d427f9a2666ea3a949ed35f8ff9511073897fab793beb4df30ec7",
  "approved_script_hash": "c8a2e0685425f8c82a033f245ada23162ffea714c53d6fd65bd3d6f053c1e609",
  "narration_preflight_result_hash": "0650e208b57295f3e4f3391b6d1281cf09e6ae977b40898948e7107c55dba1b1",
  "locked_profile_hash": "825fc824ef507df6dcdc6370c47e5e4fb31d82f357433dac741804c688d0715f",
  "decision": "approve_synthetic_narration_test",
  "reviewer_role": "human_owner",
  "decision_timestamp_utc": "2026-07-12T13:00:00Z",
  "permitted_action": "synthetic_narration_generation_only",
  "requested_output_relative_path": "proposed/synthetic_mia_narration.mp3",
  "requested_output_path_hash": "d5fa08734e45fe2fe7253892eb476a9854ba3feffba10b5a21477d159f8c40b9",
  "requested_output_format": "mp3_44100_128",
  "network_authorized": false,
  "narration_generation_authorized": true,
  "asset_authorized": false,
  "assembly_authorized": false,
  "rendering_authorized": false,
  "upload_authorized": false,
  "scheduling_authorized": false,
  "publishing_enabled": false,
  "real_production_enabled": false
}
